Food_ID,Name,C_Type,Veg_Non,Describe,combined_features
2855,Lentils Stir fry,American,Veg,lentils bread capsicum ginger garlic salt cumin olive oil,Lentils Stir fry lentils bread capsicum ginger garlic salt cumin olive oil
2856,Chicken Noodle bowl,American,Non-Veg,chicken noodles onion capsicum tomato cumin soy sauce olive oil,Chicken Noodle bowl chicken noodles onion capsicum tomato cumin soy sauce olive oil
2857,Mushroom Masala,Indian,Veg,mushroom pasta garlic ginger carrot soy sauce salt chili,Mushroom Masala mushroom pasta garlic ginger carrot soy sauce salt chili
2858,Prawn Noodle bowl,Indian,Non-Veg,prawn pasta carrot peas garlic soy sauce turmeric olive oil,Prawn Noodle bowl prawn pasta carrot peas garlic soy sauce turmeric olive oil
2859,Tofu Soup,Chinese,Veg,tofu bread garlic carrot capsicum olive oil butter chili,Tofu Soup tofu bread garlic carrot capsicum olive oil butter chili
2860,Lentils Fried rice,Japanese,Veg,lentils rice peas tomato capsicum chili olive oil turmeric,Lentils Fried rice lentils rice peas tomato capsicum chili olive oil turmeric
2861,Mutton Stir fry,Italian,Non-Veg,mutton soup peas tomato garlic chili turmeric olive oil,Mutton Stir fry mutton soup peas tomato garlic chili turmeric olive oil
2862,Chickpeas Stir fry,American,Veg,chickpeas salad tomato peas garlic turmeric pepper coriander,Chickpeas Stir fry chickpeas salad tomato peas garlic turmeric pepper coriander
2863,Prawn Curry,Japanese,Non-Veg,prawn salad spinach capsicum tomato turmeric olive oil chili,Prawn Curry prawn salad spinach capsicum tomato turmeric olive oil chili
2864,Beans Stir fry,American,Veg,beans rice tomato garlic capsicum butter pepper turmeric,Beans Stir fry beans rice tomato garlic capsicum butter pepper turmeric
2865,Lentils Pasta bowl,Indian,Veg,lentils salad capsicum onion carrot olive oil coriander soy sauce,Lentils Pasta bowl lentils salad capsicum onion carrot olive oil coriander soy sauce
2866,Potato Soup,Italian,Veg,potato rice ginger tomato carrot salt turmeric cumin,Potato Soup potato rice ginger tomato carrot salt turmeric cumin
2867,Chickpeas Gravy,Thai,Veg,chickpeas wrap onion carrot capsicum olive oil butter chili,Chickpeas Gravy chickpeas wrap onion carrot capsicum olive oil butter chili
2868,Beans Soup,Mediterranean,Veg,beans soup ginger spinach onion salt pepper chili,Beans Soup beans soup ginger spinach onion salt pepper chili
2869,Fish Masala,American,Non-Veg,fish noodles capsicum ginger garlic turmeric coriander olive oil,Fish Masala fish noodles capsicum ginger garlic turmeric coriander olive oil
2870,Fish Curry,Chinese,Non-Veg,fish bread spinach onion garlic soy sauce coriander chili,Fish Curry fish bread spinach onion garlic soy sauce coriander chili
2871,Lentils Noodle bowl,Thai,Veg,lentils pasta garlic peas carrot olive oil coriander soy sauce,Lentils Noodle bowl lentils pasta garlic peas carrot olive oil coriander soy sauce
2872,Paneer Biryani,Chinese,Veg,paneer pasta peas capsicum tomato olive oil pepper cumin,Paneer Biryani paneer pasta peas capsicum tomato olive oil pepper cumin
2873,Lentils Gravy,Thai,Veg,lentils soup garlic capsicum peas turmeric soy sauce butter,Lentils Gravy lentils soup garlic capsicum peas turmeric soy sauce butter
2874,Potato Stir fry,Italian,Veg,potato soup garlic spinach ginger chili salt turmeric,Potato Stir fry potato soup garlic spinach ginger chili salt turmeric
2875,Mushroom Biryani,American,Veg,mushroom pasta tomato onion spinach olive oil cumin pepper,Mushroom Biryani mushroom pasta tomato onion spinach olive oil cumin pepper
2876,Paneer Masala,Mexican,Veg,paneer noodles spinach garlic carrot turmeric coriander chili,Paneer Masala paneer noodles spinach garlic carrot turmeric coriander chili
2877,Beans Fried rice,Mexican,Veg,beans bread garlic capsicum tomato butter cumin turmeric,Beans Fried rice beans bread garlic capsicum tomato butter cumin turmeric
2878,Tofu Curry,Mexican,Veg,tofu pasta onion garlic carrot salt butter soy sauce,Tofu Curry tofu pasta onion garlic carrot salt butter soy sauce
2879,Chicken Gravy,American,Non-Veg,chicken rice garlic ginger spinach soy sauce pepper butter,Chicken Gravy chicken rice garlic ginger spinach soy sauce pepper butter
2880,Mutton Curry,Japanese,Non-Veg,mutton wrap capsicum carrot onion coriander soy sauce pepper,Mutton Curry mutton wrap capsicum carrot onion coriander soy sauce pepper
2881,Tofu Fried rice,American,Veg,tofu pasta onion carrot capsicum salt cumin chili,Tofu Fried rice tofu pasta onion carrot capsicum salt cumin chili
2882,Potato Fried rice,Mediterranean,Veg,potato noodles garlic capsicum onion olive oil cumin turmeric,Potato Fried rice potato noodles garlic capsicum onion olive oil cumin turmeric
2883,Fish Noodle bowl,American,Non-Veg,fish rice garlic capsicum carrot olive oil butter pepper,Fish Noodle bowl fish rice garlic capsicum carrot olive oil butter pepper
2884,Mutton Curry,Mediterranean,Non-Veg,mutton bread capsicum onion carrot soy sauce coriander chili,Mutton Curry mutton bread capsicum onion carrot soy sauce coriander chili
2885,Chicken Curry,Mexican,Non-Veg,chicken wrap peas spinach ginger butter coriander turmeric,Chicken Curry chicken wrap peas spinach ginger butter coriander turmeric
2886,Prawn Noodle bowl,Indian,Non-Veg,prawn wrap garlic onion peas chili coriander turmeric,Prawn Noodle bowl prawn wrap garlic onion peas chili coriander turmeric
2887,Lentils Soup,Italian,Veg,lentils bread ginger garlic spinach olive oil soy sauce turmeric,Lentils Soup lentils bread ginger garlic spinach olive oil soy sauce turmeric
2888,Chicken Pasta bowl,American,Non-Veg,chicken soup carrot ginger garlic coriander cumin soy sauce,Chicken Pasta bowl chicken soup carrot ginger garlic coriander cumin soy sauce
2889,Tofu Fried rice,Chinese,Veg,tofu salad onion spinach ginger turmeric cumin salt,Tofu Fried rice tofu salad onion spinach ginger turmeric cumin salt
2890,Mushroom Masala,Chinese,Veg,mushroom rice capsicum tomato garlic chili cumin butter,Mushroom Masala mushroom rice capsicum tomato garlic chili cumin butter
2891,Potato Soup,Japanese,Veg,potato salad spinach tomato ginger turmeric soy sauce salt,Potato Soup potato salad spinach tomato ginger turmeric soy sauce salt
2892,Tofu Stir fry,Thai,Veg,tofu bread garlic capsicum onion butter coriander turmeric,Tofu Stir fry tofu bread garlic capsicum onion butter coriander turmeric
2893,Chicken Fried rice,Japanese,Non-Veg,chicken pasta capsicum tomato ginger olive oil butter soy sauce,Chicken Fried rice chicken pasta capsicum tomato ginger olive oil butter soy sauce
2894,Tofu Curry,Thai,Veg,tofu salad garlic onion carrot cumin pepper salt,Tofu Curry tofu salad garlic onion carrot cumin pepper salt
2895,Prawn Stir fry,American,Non-Veg,prawn salad carrot tomato garlic butter salt pepper,Prawn Stir fry prawn salad carrot tomato garlic butter salt pepper
2896,Egg Noodle bowl,Thai,Non-Veg,egg bread capsicum peas spinach salt butter coriander,Egg Noodle bowl egg bread capsicum peas spinach salt butter coriander
2897,Mutton Noodle bowl,American,Non-Veg,mutton soup capsicum ginger spinach olive oil salt butter,Mutton Noodle bowl mutton soup capsicum ginger spinach olive oil salt butter
2898,Tofu Biryani,Japanese,Veg,tofu salad onion garlic tomato soy sauce pepper coriander,Tofu Biryani tofu salad onion garlic tomato soy sauce pepper coriander
2899,Fish Stir fry,Italian,Non-Veg,fish pasta garlic peas capsicum coriander pepper olive oil,Fish Stir fry fish pasta garlic peas capsicum coriander pepper olive oil
2900,Tofu Curry,Thai,Veg,tofu soup capsicum carrot spinach salt olive oil butter,Tofu Curry tofu soup capsicum carrot spinach salt olive oil butter
2901,Lentils Fried rice,Indian,Veg,lentils salad carrot capsicum ginger coriander chili salt,Lentils Fried rice lentils salad carrot capsicum ginger coriander chili salt
2902,Prawn Gravy,Mexican,Non-Veg,prawn wrap spinach tomato capsicum coriander pepper soy sauce,Prawn Gravy prawn wrap spinach tomato capsicum coriander pepper soy sauce
2903,Lentils Noodle bowl,Chinese,Veg,lentils bread tomato spinach garlic pepper butter coriander,Lentils Noodle bowl lentils bread tomato spinach garlic pepper butter coriander
2904,Lentils Fried rice,American,Veg,lentils rice onion capsicum peas salt butter chili,Lentils Fried rice lentils rice onion capsicum peas salt butter chili
2905,Mushroom Stir fry,Italian,Veg,mushroom rice carrot tomato onion salt butter coriander,Mushroom Stir fry mushroom rice carrot tomato onion salt butter coriander
2906,Prawn Soup,Mexican,Non-Veg,prawn bread peas ginger carrot chili salt cumin,Prawn Soup prawn bread peas ginger carrot chili salt cumin
2907,Tofu Noodle bowl,Italian,Veg,tofu noodles onion garlic peas cumin turmeric soy sauce,Tofu Noodle bowl tofu noodles onion garlic peas cumin turmeric soy sauce
2908,Paneer Curry,Mediterranean,Veg,paneer rice capsicum tomato onion coriander butter olive oil,Paneer Curry paneer rice capsicum tomato onion coriander butter olive oil
2909,Lentils Biryani,Japanese,Veg,lentils salad carrot tomato capsicum coriander turmeric salt,Lentils Biryani lentils salad carrot tomato capsicum coriander turmeric salt
2910,Mutton Curry,Japanese,Non-Veg,mutton wrap peas tomato carrot cumin butter olive oil,Mutton Curry mutton wrap peas tomato carrot cumin butter olive oil
2911,Chicken Gravy,Japanese,Non-Veg,chicken pasta onion capsicum ginger cumin salt butter,Chicken Gravy chicken pasta onion capsicum ginger cumin salt butter
2912,Beans Noodle bowl,American,Veg,beans rice garlic tomato carrot soy sauce coriander cumin,Beans Noodle bowl beans rice garlic tomato carrot soy sauce coriander cumin
2913,Mutton Noodle bowl,Italian,Non-Veg,mutton rice carrot ginger onion butter soy sauce chili,Mutton Noodle bowl mutton rice carrot ginger onion butter soy sauce chili
2914,Paneer Gravy,Thai,Veg,paneer pasta peas capsicum tomato olive oil coriander cumin,Paneer Gravy paneer pasta peas capsicum tomato olive oil coriander cumin
2915,Tofu Pasta bowl,Thai,Veg,tofu salad capsicum peas spinach butter soy sauce chili,Tofu Pasta bowl tofu salad capsicum peas spinach butter soy sauce chili
2916,Prawn Noodle bowl,Mexican,Non-Veg,prawn bread carrot onion garlic olive oil salt soy sauce,Prawn Noodle bowl prawn bread carrot onion garlic olive oil salt soy sauce
2917,Egg Biryani,Japanese,Non-Veg,egg soup capsicum onion peas olive oil cumin salt,Egg Biryani egg soup capsicum onion peas olive oil cumin salt
2918,Tofu Masala,Thai,Veg,tofu noodles capsicum carrot spinach turmeric butter pepper,Tofu Masala tofu noodles capsicum carrot spinach turmeric butter pepper
2919,Beans Masala,American,Veg,beans soup onion capsicum garlic pepper soy sauce butter,Beans Masala beans soup onion capsicum garlic pepper soy sauce butter
2920,Chicken Noodle bowl,Thai,Non-Veg,chicken soup onion capsicum ginger butter pepper turmeric,Chicken Noodle bowl chicken soup onion capsicum ginger butter pepper turmeric
2921,Mushroom Curry,Italian,Veg,mushroom bread carrot peas spinach butter cumin coriander,Mushroom Curry mushroom bread carrot peas spinach butter cumin coriander
2922,Paneer Noodle bowl,Chinese,Veg,paneer wrap carrot tomato capsicum cumin turmeric soy sauce,Paneer Noodle bowl paneer wrap carrot tomato capsicum cumin turmeric soy sauce
2923,Potato Pasta bowl,Mexican,Veg,potato rice peas onion carrot chili coriander salt,Potato Pasta bowl potato rice peas onion carrot chili coriander salt
2924,Lentils Curry,Indian,Veg,lentils soup garlic ginger tomato olive oil chili pepper,Lentils Curry lentils soup garlic ginger tomato olive oil chili pepper
2925,Egg Curry,Mediterranean,Non-Veg,egg bread ginger onion capsicum salt chili pepper,Egg Curry egg bread ginger onion capsicum salt chili pepper
2926,Egg Soup,Chinese,Non-Veg,egg pasta garlic spinach capsicum pepper soy sauce chili,Egg Soup egg pasta garlic spinach capsicum pepper soy sauce chili
2927,Paneer Stir fry,Japanese,Veg,paneer salad garlic carrot onion pepper butter olive oil,Paneer Stir fry paneer salad garlic carrot onion pepper butter olive oil
2928,Potato Biryani,American,Veg,potato bread ginger spinach onion olive oil cumin soy sauce,Potato Biryani potato bread ginger spinach onion olive oil cumin soy sauce
2929,Beans Fried rice,Mediterranean,Veg,beans pasta carrot ginger garlic pepper cumin salt,Beans Fried rice beans pasta carrot ginger garlic pepper cumin salt
2930,Egg Soup,Mediterranean,Non-Veg,egg pasta capsicum ginger onion salt pepper turmeric,Egg Soup egg pasta capsicum ginger onion salt pepper turmeric
2931,Prawn Pasta bowl,American,Non-Veg,prawn soup peas ginger spinach butter chili turmeric,Prawn Pasta bowl prawn soup peas ginger spinach butter chili turmeric
2932,Chickpeas Soup,Japanese,Veg,chickpeas wrap carrot ginger spinach pepper soy sauce olive oil,Chickpeas Soup chickpeas wrap carrot ginger spinach pepper soy sauce olive oil
2933,Potato Gravy,Mexican,Veg,potato salad peas tomato ginger olive oil salt turmeric,Potato Gravy potato salad peas tomato ginger olive oil salt turmeric
2934,Mushroom Curry,Italian,Veg,mushroom wrap ginger tomato carrot coriander pepper olive oil,Mushroom Curry mushroom wrap ginger tomato carrot coriander pepper olive oil
2935,Fish Biryani,Chinese,Non-Veg,fish soup peas tomato capsicum cumin soy sauce chili,Fish Biryani fish soup peas tomato capsicum cumin soy sauce chili
2936,Chickpeas Noodle bowl,Italian,Veg,chickpeas bread onion spinach tomato cumin olive oil pepper,Chickpeas Noodle bowl chickpeas bread onion spinach tomato cumin olive oil pepper
2937,Chicken Soup,Chinese,Non-Veg,chicken noodles capsicum tomato spinach butter coriander salt,Chicken Soup chicken noodles capsicum tomato spinach butter coriander salt
2938,Prawn Masala,Chinese,Non-Veg,prawn pasta tomato peas garlic butter cumin olive oil,Prawn Masala prawn pasta tomato peas garlic butter cumin olive oil
2939,Egg Stir fry,Indian,Non-Veg,egg soup peas onion garlic salt chili butter,Egg Stir fry egg soup peas onion garlic salt chili butter
2940,Chickpeas Stir fry,American,Veg,chickpeas soup peas tomato carrot salt soy sauce coriander,Chickpeas Stir fry chickpeas soup peas tomato carrot salt soy sauce coriander
2941,Fish Curry,Chinese,Non-Veg,fish rice garlic ginger onion cumin coriander olive oil,Fish Curry fish rice garlic ginger onion cumin coriander olive oil
2942,Mushroom Gravy,Indian,Veg,mushroom rice carrot capsicum peas olive oil butter soy sauce,Mushroom Gravy mushroom rice carrot capsicum peas olive oil butter soy sauce
2943,Fish Soup,Chinese,Non-Veg,fish pasta spinach carrot ginger coriander butter cumin,Fish Soup fish pasta spinach carrot ginger coriander butter cumin
2944,Egg Fried rice,Chinese,Non-Veg,egg wrap garlic onion ginger pepper soy sauce salt,Egg Fried rice egg wrap garlic onion ginger pepper soy sauce salt
2945,Mushroom Pasta bowl,Mexican,Veg,mushroom salad garlic onion ginger coriander pepper butter,Mushroom Pasta bowl mushroom salad garlic onion ginger coriander pepper butter
2946,Lentils Soup,Chinese,Veg,lentils wrap capsicum onion carrot turmeric cumin chili,Lentils Soup lentils wrap capsicum onion carrot turmeric cumin chili
2947,Mutton Gravy,Japanese,Non-Veg,mutton rice carrot peas tomato butter turmeric coriander,Mutton Gravy mutton rice carrot peas tomato butter turmeric coriander
2948,Fish Soup,Indian,Non-Veg,fish bread ginger onion peas cumin turmeric butter,Fish Soup fish bread ginger onion peas cumin turmeric butter
2949,Prawn Masala,Thai,Non-Veg,prawn salad tomato ginger onion cumin pepper butter,Prawn Masala prawn salad tomato ginger onion cumin pepper butter
2950,Beans Masala,Italian,Veg,beans bread spinach peas garlic turmeric olive oil cumin,Beans Masala beans bread spinach peas garlic turmeric olive oil cumin
2951,Tofu Fried rice,Thai,Veg,tofu soup carrot onion tomato olive oil chili cumin,Tofu Fried rice tofu soup carrot onion tomato olive oil chili cumin
2952,Potato Biryani,Chinese,Veg,potato pasta spinach garlic ginger butter pepper soy sauce,Potato Biryani potato pasta spinach garlic ginger butter pepper soy sauce
2953,Chicken Fried rice,Japanese,Non-Veg,chicken pasta carrot spinach ginger pepper coriander soy sauce,Chicken Fried rice chicken pasta carrot spinach ginger pepper coriander soy sauce
2954,Chicken Fried rice,Chinese,Non-Veg,chicken pasta ginger peas capsicum pepper olive oil salt,Chicken Fried rice chicken pasta ginger peas capsicum pepper olive oil salt
2955,Mushroom Stir fry,American,Veg,mushroom bread onion garlic peas salt turmeric coriander,Mushroom Stir fry mushroom bread onion garlic peas salt turmeric coriander
2956,Prawn Stir fry,American,Non-Veg,prawn soup ginger capsicum tomato turmeric butter salt,Prawn Stir fry prawn soup ginger capsicum tomato turmeric butter salt
2957,Potato Fried rice,Chinese,Veg,potato bread capsicum onion ginger soy sauce chili turmeric,Potato Fried rice potato bread capsicum onion ginger soy sauce chili turmeric
2958,Tofu Pasta bowl,American,Veg,tofu wrap capsicum peas spinach chili cumin coriander,Tofu Pasta bowl tofu wrap capsicum peas spinach chili cumin coriander
2959,Fish Pasta bowl,Mediterranean,Non-Veg,fish rice peas garlic tomato butter pepper turmeric,Fish Pasta bowl fish rice peas garlic tomato butter pepper turmeric
2960,Tofu Noodle bowl,Japanese,Veg,tofu salad carrot tomato ginger olive oil pepper cumin,Tofu Noodle bowl tofu salad carrot tomato ginger olive oil pepper cumin
2961,Mutton Noodle bowl,Chinese,Non-Veg,mutton noodles peas onion carrot soy sauce pepper butter,Mutton Noodle bowl mutton noodles peas onion carrot soy sauce pepper butter
2962,Prawn Noodle bowl,Japanese,Non-Veg,prawn noodles spinach peas onion coriander pepper salt,Prawn Noodle bowl prawn noodles spinach peas onion coriander pepper salt
2963,Tofu Fried rice,Japanese,Veg,tofu pasta capsicum garlic ginger salt coriander pepper,Tofu Fried rice tofu pasta capsicum garlic ginger salt coriander pepper
2964,Mutton Noodle bowl,Italian,Non-Veg,mutton salad peas capsicum tomato turmeric butter chili,Mutton Noodle bowl mutton salad peas capsicum tomato turmeric butter chili
2965,Beans Soup,Thai,Veg,beans pasta tomato peas onion cumin soy sauce salt,Beans Soup beans pasta tomato peas onion cumin soy sauce salt
2966,Paneer Noodle bowl,Thai,Veg,paneer wrap onion capsicum carrot pepper turmeric soy sauce,Paneer Noodle bowl paneer wrap onion capsicum carrot pepper turmeric soy sauce
2967,Paneer Noodle bowl,Japanese,Veg,paneer pasta capsicum peas tomato butter coriander pepper,Paneer Noodle bowl paneer pasta capsicum peas tomato butter coriander pepper
2968,Potato Noodle bowl,Indian,Veg,potato wrap spinach carrot capsicum butter pepper turmeric,Potato Noodle bowl potato wrap spinach carrot capsicum butter pepper turmeric
2969,Mutton Noodle bowl,Indian,Non-Veg,mutton pasta capsicum peas garlic soy sauce olive oil coriander,Mutton Noodle bowl mutton pasta capsicum peas garlic soy sauce olive oil coriander
2970,Chicken Gravy,Italian,Non-Veg,chicken rice peas onion ginger butter coriander olive oil,Chicken Gravy chicken rice peas onion ginger butter coriander olive oil
2971,Mutton Soup,American,Non-Veg,mutton pasta garlic onion ginger butter chili coriander,Mutton Soup mutton pasta garlic onion ginger butter chili coriander
2972,Chickpeas Gravy,American,Veg,chickpeas wrap carrot onion garlic turmeric butter chili,Chickpeas Gravy chickpeas wrap carrot onion garlic turmeric butter chili
2973,Chickpeas Curry,Mexican,Veg,chickpeas bread peas tomato ginger cumin pepper salt,Chickpeas Curry chickpeas bread peas tomato ginger cumin pepper salt
2974,Prawn Fried rice,American,Non-Veg,prawn bread peas spinach tomato butter turmeric salt,Prawn Fried rice prawn bread peas spinach tomato butter turmeric salt
2975,Potato Noodle bowl,Italian,Veg,potato rice capsicum onion tomato cumin chili olive oil,Potato Noodle bowl potato rice capsicum onion tomato cumin chili olive oil
2976,Prawn Stir fry,Indian,Non-Veg,prawn wrap spinach ginger carrot butter pepper turmeric,Prawn Stir fry prawn wrap spinach ginger carrot butter pepper turmeric
2977,Potato Curry,Mediterranean,Veg,potato bread peas ginger tomato salt pepper olive oil,Potato Curry potato bread peas ginger tomato salt pepper olive oil
2978,Paneer Curry,Chinese,Veg,paneer salad garlic peas ginger olive oil soy sauce butter,Paneer Curry paneer salad garlic peas ginger olive oil soy sauce butter
2979,Mutton Biryani,Mexican,Non-Veg,mutton rice tomato carrot capsicum soy sauce salt butter,Mutton Biryani mutton rice tomato carrot capsicum soy sauce salt butter
2980,Mutton Curry,American,Non-Veg,mutton bread ginger capsicum garlic salt soy sauce coriander,Mutton Curry mutton bread ginger capsicum garlic salt soy sauce coriander
2981,Egg Stir fry,Chinese,Non-Veg,egg wrap spinach carrot garlic butter pepper olive oil,Egg Stir fry egg wrap spinach carrot garlic butter pepper olive oil
2982,Paneer Curry,Italian,Veg,paneer bread garlic tomato capsicum coriander turmeric cumin,Paneer Curry paneer bread garlic tomato capsicum coriander turmeric cumin
2983,Paneer Fried rice,Japanese,Veg,paneer pasta carrot capsicum ginger chili coriander cumin,Paneer Fried rice paneer pasta carrot capsicum ginger chili coriander cumin
2984,Egg Biryani,Thai,Non-Veg,egg rice ginger garlic peas butter turmeric cumin,Egg Biryani egg rice ginger garlic peas butter turmeric cumin
2985,Mushroom Fried rice,American,Veg,mushroom bread peas spinach tomato soy sauce coriander pepper,Mushroom Fried rice mushroom bread peas spinach tomato soy sauce coriander pepper
2986,Mushroom Soup,Indian,Veg,mushroom salad spinach peas onion cumin pepper olive oil,Mushroom Soup mushroom salad spinach peas onion cumin pepper olive oil
2987,Fish Stir fry,Japanese,Non-Veg,fish soup ginger capsicum onion salt butter turmeric,Fish Stir fry fish soup ginger capsicum onion salt butter turmeric
2988,Chickpeas Stir fry,Italian,Veg,chickpeas pasta capsicum ginger tomato cumin salt pepper,Chickpeas Stir fry chickpeas pasta capsicum ginger tomato cumin salt pepper
2989,Mutton Biryani,American,Non-Veg,mutton noodles onion spinach carrot cumin butter chili,Mutton Biryani mutton noodles onion spinach carrot cumin butter chili
2990,Fish Biryani,Indian,Non-Veg,fish soup peas spinach onion butter chili olive oil,Fish Biryani fish soup peas spinach onion butter chili olive oil
2991,Prawn Biryani,Indian,Non-Veg,prawn wrap tomato peas onion olive oil chili turmeric,Prawn Biryani prawn wrap tomato peas onion olive oil chili turmeric
2992,Egg Gravy,Mexican,Non-Veg,egg bread carrot peas garlic salt soy sauce butter,Egg Gravy egg bread carrot peas garlic salt soy sauce butter
2993,Mushroom Gravy,Indian,Veg,mushroom soup carrot tomato onion cumin soy sauce pepper,Mushroom Gravy mushroom soup carrot tomato onion cumin soy sauce pepper
2994,Fish Masala,Indian,Non-Veg,fish rice peas ginger capsicum pepper butter coriander,Fish Masala fish rice peas ginger capsicum pepper butter coriander
2995,Prawn Biryani,Chinese,Non-Veg,prawn pasta carrot ginger tomato cumin coriander olive oil,Prawn Biryani prawn pasta carrot ginger tomato cumin coriander olive oil
2996,Prawn Curry,Mexican,Non-Veg,prawn noodles ginger capsicum carrot salt pepper butter,Prawn Curry prawn noodles ginger capsicum carrot salt pepper butter
2997,Mutton Masala,Thai,Non-Veg,mutton wrap peas tomato spinach salt coriander butter,Mutton Masala mutton wrap peas tomato spinach salt coriander butter
2998,Chicken Stir fry,American,Non-Veg,chicken bread spinach garlic carrot soy sauce olive oil turmeric,Chicken Stir fry chicken bread spinach garlic carrot soy sauce olive oil turmeric
2999,Lentils Biryani,Mediterranean,Veg,lentils bread carrot peas onion chili butter turmeric,Lentils Biryani lentils bread carrot peas onion chili butter turmeric
3000,Beans Masala,Thai,Veg,beans wrap carrot peas ginger soy sauce chili coriander,Beans Masala beans wrap carrot peas ginger soy sauce chili coriander
3001,Egg Curry,Japanese,Non-Veg,egg bread capsicum ginger tomato butter chili turmeric,Egg Curry egg bread capsicum ginger tomato butter chili turmeric
3002,Tofu Soup,Japanese,Veg,tofu noodles peas garlic spinach pepper olive oil salt,Tofu Soup tofu noodles peas garlic spinach pepper olive oil salt
3003,Mutton Gravy,Mexican,Non-Veg,mutton rice peas spinach garlic soy sauce pepper chili,Mutton Gravy mutton rice peas spinach garlic soy sauce pepper chili
3004,Chickpeas Fried rice,Thai,Veg,chickpeas rice carrot ginger onion butter pepper salt,Chickpeas Fried rice chickpeas rice carrot ginger onion butter pepper salt
3005,Prawn Biryani,Mediterranean,Non-Veg,prawn rice garlic ginger spinach cumin chili salt,Prawn Biryani prawn rice garlic ginger spinach cumin chili salt
3006,Chicken Soup,Indian,Non-Veg,chicken wrap onion spinach carrot soy sauce turmeric cumin,Chicken Soup chicken wrap onion spinach carrot soy sauce turmeric cumin
3007,Fish Fried rice,Chinese,Non-Veg,fish soup capsicum garlic ginger soy sauce salt chili,Fish Fried rice fish soup capsicum garlic ginger soy sauce salt chili
3008,Mutton Soup,Mediterranean,Non-Veg,mutton wrap ginger tomato capsicum olive oil pepper butter,Mutton Soup mutton wrap ginger tomato capsicum olive oil pepper butter
3009,Mutton Biryani,Chinese,Non-Veg,mutton pasta tomato capsicum carrot pepper salt chili,Mutton Biryani mutton pasta tomato capsicum carrot pepper salt chili
3010,Beans Pasta bowl,Italian,Veg,beans wrap peas capsicum ginger chili butter coriander,Beans Pasta bowl beans wrap peas capsicum ginger chili butter coriander
3011,Chicken Masala,Thai,Non-Veg,chicken soup onion tomato garlic olive oil coriander chili,Chicken Masala chicken soup onion tomato garlic olive oil coriander chili
3012,Prawn Biryani,Thai,Non-Veg,prawn pasta onion garlic capsicum cumin turmeric butter,Prawn Biryani prawn pasta onion garlic capsicum cumin turmeric butter
3013,Egg Masala,Mexican,Non-Veg,egg wrap carrot garlic spinach turmeric butter soy sauce,Egg Masala egg wrap carrot garlic spinach turmeric butter soy sauce
