Food_ID,Name,C_Type,Veg_Non,Describe,combined_features
4438,Tofu Curry,Chinese,Veg,tofu bread capsicum peas garlic pepper butter turmeric,Tofu Curry tofu bread capsicum peas garlic pepper butter turmeric
4439,Paneer Stir fry,Thai,Veg,paneer bread ginger spinach capsicum pepper chili turmeric,Paneer Stir fry paneer bread ginger spinach capsicum pepper chili turmeric
4440,Chickpeas Curry,American,Veg,chickpeas pasta spinach garlic peas olive oil cumin chili,Chickpeas Curry chickpeas pasta spinach garlic peas olive oil cumin chili
4441,Potato Curry,Japanese,Veg,potato bread spinach carrot onion pepper coriander cumin,Potato Curry potato bread spinach carrot onion pepper coriander cumin
4442,Fish Noodle bowl,American,Non-Veg,fish bread garlic ginger tomato butter olive oil cumin,Fish Noodle bowl fish bread garlic ginger tomato butter olive oil cumin
4443,Chicken Fried rice,Mexican,Non-Veg,chicken rice peas ginger garlic chili butter coriander,Chicken Fried rice chicken rice peas ginger garlic chili butter coriander
4444,Prawn Stir fry,American,Non-Veg,prawn noodles tomato garlic capsicum cumin coriander soy sauce,Prawn Stir fry prawn noodles tomato garlic capsicum cumin coriander soy sauce
4445,Mutton Curry,Mexican,Non-Veg,mutton soup onion capsicum spinach cumin salt pepper,Mutton Curry mutton soup onion capsicum spinach cumin salt pepper
4446,Prawn Biryani,American,Non-Veg,prawn wrap ginger tomato carrot soy sauce turmeric coriander,Prawn Biryani prawn wrap ginger tomato carrot soy sauce turmeric coriander
4447,Potato Noodle bowl,Japanese,Veg,potato wrap capsicum tomato ginger chili coriander turmeric,Potato Noodle bowl potato wrap capsicum tomato ginger chili coriander turmeric
4448,Tofu Stir fry,Italian,Veg,tofu pasta peas garlic onion olive oil butter salt,Tofu Stir fry tofu pasta peas garlic onion olive oil butter salt
4449,Beans Noodle bowl,Indian,Veg,beans wrap ginger tomato capsicum butter cumin turmeric,Beans Noodle bowl beans wrap ginger tomato capsicum butter cumin turmeric
4450,Lentils Curry,Mediterranean,Veg,lentils bread onion spinach garlic chili olive oil salt,Lentils Curry lentils bread onion spinach garlic chili olive oil salt
4451,Prawn Gravy,Mediterranean,Non-Veg,prawn bread garlic carrot ginger olive oil turmeric cumin,Prawn Gravy prawn bread garlic carrot ginger olive oil turmeric cumin
4452,Paneer Pasta bowl,Mediterranean,Veg,paneer soup carrot ginger garlic coriander salt chili,Paneer Pasta bowl paneer soup carrot ginger garlic coriander salt chili
4453,Mutton Noodle bowl,Mediterranean,Non-Veg,mutton pasta spinach ginger capsicum chili butter cumin,Mutton Noodle bowl mutton pasta spinach ginger capsicum chili butter cumin
4454,Paneer Curry,Mexican,Veg,paneer pasta onion ginger garlic soy sauce salt coriander,Paneer Curry paneer pasta onion ginger garlic soy sauce salt coriander
4455,Chickpeas Gravy,Mexican,Veg,chickpeas soup capsicum carrot onion cumin butter pepper,Chickpeas Gravy chickpeas soup capsicum carrot onion cumin butter pepper
4456,Mushroom Stir fry,Thai,Veg,mushroom bread tomato carrot garlic turmeric pepper soy sauce,Mushroom Stir fry mushroom bread tomato carrot garlic turmeric pepper soy sauce
4457,Lentils Masala,Mexican,Veg,lentils rice garlic ginger onion pepper soy sauce butter,Lentils Masala lentils rice garlic ginger onion pepper soy sauce butter
4458,Beans Soup,Italian,Veg,beans wrap capsicum tomato garlic olive oil soy sauce chili,Beans Soup beans wrap capsicum tomato garlic olive oil soy sauce chili
4459,Mushroom Biryani,Italian,Veg,mushroom rice tomato onion capsicum cumin turmeric olive oil,Mushroom Biryani mushroom rice tomato onion capsicum cumin turmeric olive oil
4460,Chicken Soup,Indian,Non-Veg,chicken soup carrot garlic onion salt olive oil cumin,Chicken Soup chicken soup carrot garlic onion salt olive oil cumin
4461,Paneer Stir fry,Japanese,Veg,paneer rice capsicum peas ginger coriander turmeric soy sauce,Paneer Stir fry paneer rice capsicum peas ginger coriander turmeric soy sauce
4462,Mushroom Soup,Thai,Veg,mushroom salad onion carrot spinach salt coriander turmeric,Mushroom Soup mushroom salad onion carrot spinach salt coriander turmeric
4463,Chicken Gravy,Italian,Non-Veg,chicken bread ginger spinach onion coriander cumin soy sauce,Chicken Gravy chicken bread ginger spinach onion coriander cumin soy sauce
4464,Potato Pasta bowl,Mexican,Veg,potato rice ginger garlic tomato coriander turmeric soy sauce,Potato Pasta bowl potato rice ginger garlic tomato coriander turmeric soy sauce
4465,Fish Fried rice,Thai,Non-Veg,fish wrap spinach tomato capsicum chili olive oil turmeric,Fish Fried rice fish wrap spinach tomato capsicum chili olive oil turmeric
4466,Prawn Masala,Indian,Non-Veg,prawn rice carrot onion capsicum cumin chili coriander,Prawn Masala prawn rice carrot onion capsicum cumin chili coriander
4467,Fish Biryani,Chinese,Non-Veg,fish soup carrot peas capsicum turmeric pepper cumin,Fish Biryani fish soup carrot peas capsicum turmeric pepper cumin
4468,Beans Stir fry,Japanese,Veg,beans rice peas garlic capsicum chili butter olive oil,Beans Stir fry beans rice peas garlic capsicum chili butter olive oil
4469,Potato Masala,Chinese,Veg,potato bread capsicum peas garlic salt olive oil cumin,Potato Masala potato bread capsicum peas garlic salt olive oil cumin
4470,Lentils Curry,Italian,Veg,lentils soup peas capsicum carrot salt butter cumin,Lentils Curry lentils soup peas capsicum carrot salt butter cumin
4471,Prawn Noodle bowl,Japanese,Non-Veg,prawn rice garlic peas ginger turmeric pepper chili,Prawn Noodle bowl prawn rice garlic peas ginger turmeric pepper chili
4472,Lentils Stir fry,Japanese,Veg,lentils bread peas tomato garlic olive oil turmeric soy sauce,Lentils Stir fry lentils bread peas tomato garlic olive oil turmeric soy sauce
4473,Chickpeas Stir fry,Mediterranean,Veg,chickpeas soup ginger carrot capsicum coriander soy sauce pepper,Chickpeas Stir fry chickpeas soup ginger carrot capsicum coriander soy sauce pepper
4474,Paneer Gravy,Mediterranean,Veg,paneer soup capsicum ginger onion olive oil butter turmeric,Paneer Gravy paneer soup capsicum ginger onion olive oil butter turmeric
4475,Potato Noodle bowl,Italian,Veg,potato pasta tomato spinach carrot turmeric chili olive oil,Potato Noodle bowl potato pasta tomato spinach carrot turmeric chili olive oil
4476,Chickpeas Noodle bowl,Chinese,Veg,chickpeas wrap spinach capsicum garlic pepper soy sauce olive oil,Chickpeas Noodle bowl chickpeas wrap spinach capsicum garlic pepper soy sauce olive oil
4477,Beans Curry,Italian,Veg,beans salad garlic onion capsicum coriander chili salt,Beans Curry beans salad garlic onion capsicum coriander chili salt
4478,Chicken Noodle bowl,Mexican,Non-Veg,chicken bread spinach peas carrot cumin salt chili,Chicken Noodle bowl chicken bread spinach peas carrot cumin salt chili
4479,Egg Masala,Mexican,Non-Veg,egg salad carrot peas capsicum chili olive oil pepper,Egg Masala egg salad carrot peas capsicum chili olive oil pepper
4480,Paneer Pasta bowl,Mexican,Veg,paneer pasta garlic ginger carrot butter olive oil turmeric,Paneer Pasta bowl paneer pasta garlic ginger carrot butter olive oil turmeric
4481,Chickpeas Biryani,Italian,Veg,chickpeas pasta spinach garlic peas salt soy sauce butter,Chickpeas Biryani chickpeas pasta spinach garlic peas salt soy sauce butter
4482,Mutton Soup,Thai,Non-Veg,mutton noodles onion garlic spinach turmeric soy sauce olive oil,Mutton Soup mutton noodles onion garlic spinach turmeric soy sauce olive oil
4483,Egg Fried rice,Mexican,Non-Veg,egg pasta onion tomato capsicum chili salt cumin,Egg Fried rice egg pasta onion tomato capsicum chili salt cumin
4484,Mushroom Noodle bowl,American,Veg,mushroom salad carrot capsicum tomato coriander turmeric pepper,Mushroom Noodle bowl mushroom salad carrot capsicum tomato coriander turmeric pepper
4485,Mushroom Masala,Chinese,Veg,mushroom wrap peas onion capsicum butter soy sauce chili,Mushroom Masala mushroom wrap peas onion capsicum butter soy sauce chili
4486,Paneer Fried rice,Thai,Veg,paneer bread peas carrot spinach turmeric olive oil salt,Paneer Fried rice paneer bread peas carrot spinach turmeric olive oil salt
4487,Mushroom Biryani,Mexican,Veg,mushroom bread onion garlic spinach turmeric soy sauce pepper,Mushroom Biryani mushroom bread onion garlic spinach turmeric soy sauce pepper
4488,Tofu Masala,Thai,Veg,tofu soup carrot onion ginger chili turmeric salt,Tofu Masala tofu soup carrot onion ginger chili turmeric salt
4489,Prawn Fried rice,American,Non-Veg,prawn bread onion peas ginger olive oil coriander chili,Prawn Fried rice prawn bread onion peas ginger olive oil coriander chili
4490,Potato Stir fry,Japanese,Veg,potato noodles spinach peas carrot olive oil soy sauce pepper,Potato Stir fry potato noodles spinach peas carrot olive oil soy sauce pepper
4491,Lentils Curry,Indian,Veg,lentils pasta onion capsicum ginger butter soy sauce olive oil,Lentils Curry lentils pasta onion capsicum ginger butter soy sauce olive oil
4492,Egg Pasta bowl,Indian,Non-Veg,egg pasta onion capsicum ginger cumin olive oil turmeric,Egg Pasta bowl egg pasta onion capsicum ginger cumin olive oil turmeric
4493,Chicken Pasta bowl,Italian,Non-Veg,chicken salad tomato spinach ginger turmeric salt cumin,Chicken Pasta bowl chicken salad tomato spinach ginger turmeric salt cumin
4494,Potato Biryani,Chinese,Veg,potato rice capsicum tomato carrot turmeric chili coriander,Potato Biryani potato rice capsicum tomato carrot turmeric chili coriander
4495,Chicken Masala,Mexican,Non-Veg,chicken noodles tomato capsicum onion coriander cumin turmeric,Chicken Masala chicken noodles tomato capsicum onion coriander cumin turmeric
4496,Fish Soup,Chinese,Non-Veg,fish rice garlic carrot ginger turmeric pepper butter,Fish Soup fish rice garlic carrot ginger turmeric pepper butter
4497,Lentils Masala,American,Veg,lentils noodles ginger spinach garlic pepper salt butter,Lentils Masala lentils noodles ginger spinach garlic pepper salt butter
4498,Tofu Noodle bowl,Chinese,Veg,tofu pasta capsicum ginger carrot cumin turmeric coriander,Tofu Noodle bowl tofu pasta capsicum ginger carrot cumin turmeric coriander
4499,Prawn Gravy,Thai,Non-Veg,prawn soup onion garlic capsicum butter pepper salt,Prawn Gravy prawn soup onion garlic capsicum butter pepper salt
4500,Tofu Biryani,Indian,Veg,tofu soup peas onion tomato pepper salt coriander,Tofu Biryani tofu soup peas onion tomato pepper salt coriander
4501,Chickpeas Stir fry,Chinese,Veg,chickpeas wrap onion ginger garlic butter coriander soy sauce,Chickpeas Stir fry chickpeas wrap onion ginger garlic butter coriander soy sauce
4502,Fish Masala,Mediterranean,Non-Veg,fish rice garlic tomato peas coriander chili pepper,Fish Masala fish rice garlic tomato peas coriander chili pepper
4503,Tofu Pasta bowl,Mediterranean,Veg,tofu rice tomato peas spinach soy sauce chili cumin,Tofu Pasta bowl tofu rice tomato peas spinach soy sauce chili cumin
4504,Potato Biryani,Italian,Veg,potato noodles spinach tomato peas chili cumin soy sauce,Potato Biryani potato noodles spinach tomato peas chili cumin soy sauce
4505,Egg Stir fry,American,Non-Veg,egg wrap onion spinach tomato salt turmeric soy sauce,Egg Stir fry egg wrap onion spinach tomato salt turmeric soy sauce
4506,Tofu Biryani,Indian,Veg,tofu bread garlic capsicum carrot chili salt turmeric,Tofu Biryani tofu bread garlic capsicum carrot chili salt turmeric
4507,Prawn Soup,Chinese,Non-Veg,prawn wrap ginger spinach carrot salt butter cumin,Prawn Soup prawn wrap ginger spinach carrot salt butter cumin
4508,Chicken Biryani,Indian,Non-Veg,chicken wrap capsicum onion spinach coriander pepper butter,Chicken Biryani chicken wrap capsicum onion spinach coriander pepper butter
4509,Chickpeas Soup,Thai,Veg,chickpeas soup ginger spinach tomato butter turmeric olive oil,Chickpeas Soup chickpeas soup ginger spinach tomato butter turmeric olive oil
4510,Potato Pasta bowl,Indian,Veg,potato salad ginger onion spinach turmeric salt olive oil,Potato Pasta bowl potato salad ginger onion spinach turmeric salt olive oil
4511,Prawn Stir fry,Chinese,Non-Veg,prawn salad onion garlic capsicum cumin olive oil soy sauce,Prawn Stir fry prawn salad onion garlic capsicum cumin olive oil soy sauce
4512,Chickpeas Masala,Thai,Veg,chickpeas bread carrot capsicum tomato turmeric salt cumin,Chickpeas Masala chickpeas bread carrot capsicum tomato turmeric salt cumin
4513,Mutton Fried rice,Mexican,Non-Veg,mutton pasta capsicum peas carrot cumin pepper turmeric,Mutton Fried rice mutton pasta capsicum peas carrot cumin pepper turmeric
4514,Mutton Noodle bowl,Italian,Non-Veg,mutton wrap capsicum carrot garlic cumin coriander butter,Mutton Noodle bowl mutton wrap capsicum carrot garlic cumin coriander butter
4515,Chicken Fried rice,Indian,Non-Veg,chicken wrap carrot capsicum onion soy sauce pepper butter,Chicken Fried rice chicken wrap carrot capsicum onion soy sauce pepper butter
4516,Chicken Fried rice,Mediterranean,Non-Veg,chicken noodles peas ginger capsicum pepper butter salt,Chicken Fried rice chicken noodles peas ginger capsicum pepper butter salt
4517,Mushroom Fried rice,Mediterranean,Veg,mushroom wrap onion peas garlic salt butter coriander,Mushroom Fried rice mushroom wrap onion peas garlic salt butter coriander
4518,Mutton Pasta bowl,American,Non-Veg,mutton soup ginger garlic peas salt cumin butter,Mutton Pasta bowl mutton soup ginger garlic peas salt cumin butter
4519,Potato Stir fry,Mediterranean,Veg,potato bread peas ginger tomato olive oil butter coriander,Potato Stir fry potato bread peas ginger tomato olive oil butter coriander
4520,Prawn Stir fry,Mexican,Non-Veg,prawn pasta peas capsicum ginger cumin salt turmeric,Prawn Stir fry prawn pasta peas capsicum ginger cumin salt turmeric
4521,Mushroom Gravy,Mediterranean,Veg,mushroom pasta capsicum tomato garlic salt pepper butter,Mushroom Gravy mushroom pasta capsicum tomato garlic salt pepper butter
4522,Beans Curry,Indian,Veg,beans noodles carrot ginger peas chili salt olive oil,Beans Curry beans noodles carrot ginger peas chili salt olive oil
4523,Fish Biryani,Thai,Non-Veg,fish bread garlic tomato ginger cumin salt butter,Fish Biryani fish bread garlic tomato ginger cumin salt butter
4524,Egg Fried rice,Mexican,Non-Veg,egg rice peas garlic onion coriander butter salt,Egg Fried rice egg rice peas garlic onion coriander butter salt
4525,Chicken Masala,Japanese,Non-Veg,chicken bread tomato onion spinach butter pepper soy sauce,Chicken Masala chicken bread tomato onion spinach butter pepper soy sauce
4526,Chicken Stir fry,Mediterranean,Non-Veg,chicken noodles spinach tomato ginger cumin coriander butter,Chicken Stir fry chicken noodles spinach tomato ginger cumin coriander butter
4527,Egg Noodle bowl,Thai,Non-Veg,egg pasta tomato spinach onion cumin turmeric olive oil,Egg Noodle bowl egg pasta tomato spinach onion cumin turmeric olive oil
4528,Egg Masala,Mexican,Non-Veg,egg salad tomato spinach ginger olive oil soy sauce salt,Egg Masala egg salad tomato spinach ginger olive oil soy sauce salt
4529,Mushroom Curry,Italian,Veg,mushroom noodles garlic spinach onion soy sauce coriander salt,Mushroom Curry mushroom noodles garlic spinach onion soy sauce coriander salt
4530,Fish Fried rice,Thai,Non-Veg,fish wrap capsicum garlic ginger butter olive oil chili,Fish Fried rice fish wrap capsicum garlic ginger butter olive oil chili
4531,Mutton Stir fry,Italian,Non-Veg,mutton salad ginger peas tomato pepper soy sauce butter,Mutton Stir fry mutton salad ginger peas tomato pepper soy sauce butter
4532,Chicken Curry,Thai,Non-Veg,chicken soup ginger onion peas chili coriander butter,Chicken Curry chicken soup ginger onion peas chili coriander butter
4533,Egg Pasta bowl,Mediterranean,Non-Veg,egg bread capsicum ginger spinach cumin chili pepper,Egg Pasta bowl egg bread capsicum ginger spinach cumin chili pepper
4534,Mushroom Masala,Mexican,Veg,mushroom noodles tomato spinach capsicum coriander soy sauce pepper,Mushroom Masala mushroom noodles tomato spinach capsicum coriander soy sauce pepper
4535,Tofu Stir fry,American,Veg,tofu bread ginger peas capsicum salt olive oil chili,Tofu Stir fry tofu bread ginger peas capsicum salt olive oil chili
4536,Tofu Masala,Mediterranean,Veg,tofu pasta carrot peas capsicum turmeric olive oil cumin,Tofu Masala tofu pasta carrot peas capsicum turmeric olive oil cumin
4537,Chicken Soup,Japanese,Non-Veg,chicken noodles onion ginger peas butter turmeric cumin,Chicken Soup chicken noodles onion ginger peas butter turmeric cumin
4538,Egg Masala,Japanese,Non-Veg,egg pasta carrot peas ginger salt turmeric cumin,Egg Masala egg pasta carrot peas ginger salt turmeric cumin
4539,Beans Pasta bowl,Italian,Veg,beans rice onion garlic peas turmeric olive oil butter,Beans Pasta bowl beans rice onion garlic peas turmeric olive oil butter
4540,Potato Gravy,Indian,Veg,potato rice onion spinach peas coriander chili turmeric,Potato Gravy potato rice onion spinach peas coriander chili turmeric
4541,Fish Curry,Japanese,Non-Veg,fish bread ginger onion garlic butter olive oil chili,Fish Curry fish bread ginger onion garlic butter olive oil chili
4542,Chickpeas Pasta bowl,Mediterranean,Veg,chickpeas pasta capsicum tomato carrot olive oil pepper coriander,Chickpeas Pasta bowl chickpeas pasta capsicum tomato carrot olive oil pepper coriander
4543,Chickpeas Curry,Chinese,Veg,chickpeas wrap tomato peas carrot soy sauce butter pepper,Chickpeas Curry chickpeas wrap tomato peas carrot soy sauce butter pepper
4544,Lentils Noodle bowl,Italian,Veg,lentils noodles onion spinach garlic coriander chili pepper,Lentils Noodle bowl lentils noodles onion spinach garlic coriander chili pepper
4545,Tofu Masala,American,Veg,tofu pasta carrot spinach peas chili cumin turmeric,Tofu Masala tofu pasta carrot spinach peas chili cumin turmeric
4546,Beans Noodle bowl,Mediterranean,Veg,beans rice spinach peas carrot olive oil chili salt,Beans Noodle bowl beans rice spinach peas carrot olive oil chili salt
4547,Chicken Biryani,Thai,Non-Veg,chicken salad garlic spinach carrot salt coriander butter,Chicken Biryani chicken salad garlic spinach carrot salt coriander butter
4548,Fish Curry,Italian,Non-Veg,fish wrap capsicum onion spinach olive oil chili coriander,Fish Curry fish wrap capsicum onion spinach olive oil chili coriander
4549,Lentils Stir fry,Mediterranean,Veg,lentils wrap ginger onion tomato coriander chili turmeric,Lentils Stir fry lentils wrap ginger onion tomato coriander chili turmeric
4550,Lentils Curry,Thai,Veg,lentils rice tomato garlic carrot pepper salt coriander,Lentils Curry lentils rice tomato garlic carrot pepper salt coriander
4551,Fish Soup,Italian,Non-Veg,fish rice spinach ginger carrot soy sauce butter coriander,Fish Soup fish rice spinach ginger carrot soy sauce butter coriander
4552,Tofu Fried rice,Mediterranean,Veg,tofu wrap tomato ginger peas pepper turmeric coriander,Tofu Fried rice tofu wrap tomato ginger peas pepper turmeric coriander
4553,Paneer Noodle bowl,Indian,Veg,paneer soup tomato capsicum peas chili salt butter,Paneer Noodle bowl paneer soup tomato capsicum peas chili salt butter
4554,Mushroom Noodle bowl,American,Veg,mushroom pasta peas ginger carrot turmeric coriander olive oil,Mushroom Noodle bowl mushroom pasta peas ginger carrot turmeric coriander olive oil
4555,Beans Noodle bowl,Italian,Veg,beans soup tomato garlic spinach coriander pepper salt,Beans Noodle bowl beans soup tomato garlic spinach coriander pepper salt
4556,Chicken Noodle bowl,Japanese,Non-Veg,chicken salad onion capsicum peas cumin olive oil coriander,Chicken Noodle bowl chicken salad onion capsicum peas cumin olive oil coriander
4557,Chicken Biryani,Japanese,Non-Veg,chicken noodles ginger spinach tomato coriander cumin salt,Chicken Biryani chicken noodles ginger spinach tomato coriander cumin salt
4558,Fish Noodle bowl,Italian,Non-Veg,fish wrap tomato garlic onion butter salt pepper,Fish Noodle bowl fish wrap tomato garlic onion butter salt pepper
4559,Tofu Gravy,Japanese,Veg,tofu soup spinach tomato ginger cumin salt coriander,Tofu Gravy tofu soup spinach tomato ginger cumin salt coriander
4560,Potato Biryani,Japanese,Veg,potato salad tomato peas carrot salt pepper olive oil,Potato Biryani potato salad tomato peas carrot salt pepper olive oil
4561,Tofu Curry,American,Veg,tofu salad carrot capsicum peas turmeric butter soy sauce,Tofu Curry tofu salad carrot capsicum peas turmeric butter soy sauce
4562,Mutton Biryani,Italian,Non-Veg,mutton pasta spinach carrot onion chili soy sauce pepper,Mutton Biryani mutton pasta spinach carrot onion chili soy sauce pepper
4563,Chicken Soup,Japanese,Non-Veg,chicken pasta spinach garlic ginger olive oil cumin turmeric,Chicken Soup chicken pasta spinach garlic ginger olive oil cumin turmeric
4564,Chickpeas Noodle bowl,Japanese,Veg,chickpeas noodles carrot capsicum garlic salt coriander olive oil,Chickpeas Noodle bowl chickpeas noodles carrot capsicum garlic salt coriander olive oil
4565,Mushroom Curry,Chinese,Veg,mushroom salad capsicum spinach ginger salt soy sauce coriander,Mushroom Curry mushroom salad capsicum spinach ginger salt soy sauce coriander
4566,Chicken Masala,Japanese,Non-Veg,chicken salad garlic spinach capsicum cumin butter pepper,Chicken Masala chicken salad garlic spinach capsicum cumin butter pepper
4567,Mushroom Biryani,Mediterranean,Veg,mushroom bread ginger tomato peas chili soy sauce olive oil,Mushroom Biryani mushroom bread ginger tomato peas chili soy sauce olive oil
4568,Egg Biryani,Indian,Non-Veg,egg noodles spinach tomato garlic salt turmeric pepper,Egg Biryani egg noodles spinach tomato garlic salt turmeric pepper
4569,Fish Noodle bowl,American,Non-Veg,fish noodles garlic onion ginger cumin chili salt,Fish Noodle bowl fish noodles garlic onion ginger cumin chili salt
4570,Chicken Stir fry,Mediterranean,Non-Veg,chicken noodles capsicum ginger carrot chili soy sauce olive oil,Chicken Stir fry chicken noodles capsicum ginger carrot chili soy sauce olive oil
4571,Fish Curry,American,Non-Veg,fish rice onion peas garlic soy sauce chili cumin,Fish Curry fish rice onion peas garlic soy sauce chili cumin
4572,Paneer Gravy,Japanese,Veg,paneer salad ginger capsicum carrot salt chili butter,Paneer Gravy paneer salad ginger capsicum carrot salt chili butter
4573,Lentils Soup,American,Veg,lentils wrap carrot capsicum spinach olive oil butter pepper,Lentils Soup lentils wrap carrot capsicum spinach olive oil butter pepper
4574,Mutton Curry,Japanese,Non-Veg,mutton rice ginger peas tomato turmeric chili soy sauce,Mutton Curry mutton rice ginger peas tomato turmeric chili soy sauce
4575,Lentils Stir fry,Japanese,Veg,lentils noodles tomato capsicum spinach turmeric salt coriander,Lentils Stir fry lentils noodles tomato capsicum spinach turmeric salt coriander
4576,Mutton Biryani,Indian,Non-Veg,mutton noodles ginger capsicum spinach salt pepper turmeric,Mutton Biryani mutton noodles ginger capsicum spinach salt pepper turmeric
4577,Chickpeas Noodle bowl,Indian,Veg,chickpeas rice ginger carrot garlic salt coriander turmeric,Chickpeas Noodle bowl chickpeas rice ginger carrot garlic salt coriander turmeric
4578,Egg Biryani,Mediterranean,Non-Veg,egg pasta ginger carrot onion butter soy sauce turmeric,Egg Biryani egg pasta ginger carrot onion butter soy sauce turmeric
4579,Egg Noodle bowl,Japanese,Non-Veg,egg rice carrot peas spinach olive oil coriander chili,Egg Noodle bowl egg rice carrot peas spinach olive oil coriander chili
4580,Beans Curry,American,Veg,beans wrap spinach carrot peas salt olive oil coriander,Beans Curry beans wrap spinach carrot peas salt olive oil coriander
4581,Tofu Pasta bowl,Chinese,Veg,tofu soup ginger onion garlic olive oil butter pepper,Tofu Pasta bowl tofu soup ginger onion garlic olive oil butter pepper
4582,Mushroom Masala,American,Veg,mushroom bread carrot onion capsicum chili soy sauce turmeric,Mushroom Masala mushroom bread carrot onion capsicum chili soy sauce turmeric
4583,Prawn Stir fry,Japanese,Non-Veg,prawn pasta garlic peas spinach pepper soy sauce olive oil,Prawn Stir fry prawn pasta garlic peas spinach pepper soy sauce olive oil
4584,Chicken Stir fry,Indian,Non-Veg,chicken rice tomato spinach garlic cumin pepper salt,Chicken Stir fry chicken rice tomato spinach garlic cumin pepper salt
4585,Tofu Noodle bowl,Indian,Veg,tofu salad ginger peas carrot salt butter chili,Tofu Noodle bowl tofu salad ginger peas carrot salt butter chili
4586,Tofu Stir fry,Japanese,Veg,tofu wrap capsicum carrot peas chili cumin coriander,Tofu Stir fry tofu wrap capsicum carrot peas chili cumin coriander
4587,Mushroom Soup,American,Veg,mushroom noodles capsicum peas garlic chili olive oil salt,Mushroom Soup mushroom noodles capsicum peas garlic chili olive oil salt
4588,Mutton Masala,Mexican,Non-Veg,mutton salad onion peas spinach salt butter olive oil,Mutton Masala mutton salad onion peas spinach salt butter olive oil
4589,Tofu Fried rice,Italian,Veg,tofu salad tomato capsicum carrot chili olive oil cumin,Tofu Fried rice tofu salad tomato capsicum carrot chili olive oil cumin
4590,Fish Soup,Chinese,Non-Veg,fish bread spinach tomato carrot soy sauce coriander cumin,Fish Soup fish bread spinach tomato carrot soy sauce coriander cumin
4591,Fish Curry,Japanese,Non-Veg,fish salad spinach capsicum peas pepper olive oil chili,Fish Curry fish salad spinach capsicum peas pepper olive oil chili
4592,Chickpeas Pasta bowl,Japanese,Veg,chickpeas salad ginger onion tomato salt turmeric pepper,Chickpeas Pasta bowl chickpeas salad ginger onion tomato salt turmeric pepper
4593,Chickpeas Curry,Chinese,Veg,chickpeas pasta capsicum garlic spinach olive oil pepper coriander,Chickpeas Curry chickpeas pasta capsicum garlic spinach olive oil pepper coriander
4594,Beans Biryani,Chinese,Veg,beans rice carrot ginger garlic soy sauce salt pepper,Beans Biryani beans rice carrot ginger garlic soy sauce salt pepper
