Food_ID,Name,C_Type,Veg_Non,Describe,combined_features
1433,Chicken Fried rice,Mediterranean,Non-Veg,chicken noodles capsicum onion tomato soy sauce coriander turmeric,Chicken Fried rice chicken noodles capsicum onion tomato soy sauce coriander turmeric
1434,Mushroom Stir fry,Japanese,Veg,mushroom noodles garlic spinach tomato coriander soy sauce pepper,Mushroom Stir fry mushroom noodles garlic spinach tomato coriander soy sauce pepper
1435,Mushroom Gravy,Indian,Veg,mushroom rice ginger garlic peas olive oil salt chili,Mushroom Gravy mushroom rice ginger garlic peas olive oil salt chili
1436,Lentils Masala,Mediterranean,Veg,lentils pasta spinach garlic peas olive oil coriander salt,Lentils Masala lentils pasta spinach garlic peas olive oil coriander salt
1437,Prawn Noodle bowl,Thai,Non-Veg,prawn noodles capsicum onion tomato chili butter soy sauce,Prawn Noodle bowl prawn noodles capsicum onion tomato chili butter soy sauce
1438,Mushroom Biryani,Thai,Veg,mushroom noodles garlic onion ginger turmeric coriander salt,Mushroom Biryani mushroom noodles garlic onion ginger turmeric coriander salt
1439,Chicken Fried rice,Thai,Non-Veg,chicken wrap capsicum carrot peas pepper chili salt,Chicken Fried rice chicken wrap capsicum carrot peas pepper chili salt
1440,Lentils Fried rice,American,Veg,lentils noodles capsicum garlic carrot salt pepper olive oil,Lentils Fried rice lentils noodles capsicum garlic carrot salt pepper olive oil
1441,Egg Stir fry,American,Non-Veg,egg noodles ginger capsicum garlic chili olive oil turmeric,Egg Stir fry egg noodles ginger capsicum garlic chili olive oil turmeric
1442,Chickpeas Fried rice,Italian,Veg,chickpeas salad garlic onion peas coriander salt cumin,Chickpeas Fried rice chickpeas salad garlic onion peas coriander salt cumin
1443,Potato Soup,Mediterranean,Veg,potato rice spinach capsicum garlic butter salt soy sauce,Potato Soup potato rice spinach capsicum garlic butter salt soy sauce
1444,Egg Stir fry,Japanese,Non-Veg,egg bread spinach garlic onion cumin chili butter,Egg Stir fry egg bread spinach garlic onion cumin chili butter
1445,Mushroom Noodle bowl,Mexican,Veg,mushroom noodles tomato carrot peas turmeric chili pepper,Mushroom Noodle bowl mushroom noodles tomato carrot peas turmeric chili pepper
1446,Fish Soup,Mediterranean,Non-Veg,fish rice peas tomato ginger pepper turmeric butter,Fish Soup fish rice peas tomato ginger pepper turmeric butter
1447,Mushroom Noodle bowl,Mexican,Veg,mushroom wrap peas tomato garlic soy sauce turmeric coriander,Mushroom Noodle bowl mushroom wrap peas tomato garlic soy sauce turmeric coriander
1448,Egg Fried rice,Mediterranean,Non-Veg,egg wrap garlic peas onion soy sauce turmeric cumin,Egg Fried rice egg wrap garlic peas onion soy sauce turmeric cumin
1449,Tofu Masala,American,Veg,tofu wrap onion spinach garlic turmeric cumin pepper,Tofu Masala tofu wrap onion spinach garlic turmeric cumin pepper
1450,Potato Gravy,American,Veg,potato pasta tomato carrot ginger soy sauce turmeric pepper,Potato Gravy potato pasta tomato carrot ginger soy sauce turmeric pepper
1451,Mutton Biryani,American,Non-Veg,mutton soup ginger onion peas coriander cumin turmeric,Mutton Biryani mutton soup ginger onion peas coriander cumin turmeric
1452,Chicken Fried rice,Mexican,Non-Veg,chicken bread capsicum onion ginger cumin soy sauce olive oil,Chicken Fried rice chicken bread capsicum onion ginger cumin soy sauce olive oil
1453,Mutton Masala,Indian,Non-Veg,mutton bread onion peas tomato salt coriander butter,Mutton Masala mutton bread onion peas tomato salt coriander butter
1454,Lentils Stir fry,Thai,Veg,lentils noodles garlic spinach ginger salt cumin olive oil,Lentils Stir fry lentils noodles garlic spinach ginger salt cumin olive oil
1455,Egg Stir fry,Mexican,Non-Veg,egg rice carrot tomato spinach coriander chili salt,Egg Stir fry egg rice carrot tomato spinach coriander chili salt
1456,Tofu Noodle bowl,Italian,Veg,tofu bread onion ginger carrot chili coriander cumin,Tofu Noodle bowl tofu bread onion ginger carrot chili coriander cumin
1457,Egg Noodle bowl,American,Non-Veg,egg wrap spinach carrot onion pepper soy sauce salt,Egg Noodle bowl egg wrap spinach carrot onion pepper soy sauce salt
1458,Lentils Noodle bowl,American,Veg,lentils rice ginger carrot capsicum pepper salt cumin,Lentils Noodle bowl lentils rice ginger carrot capsicum pepper salt cumin
1459,Egg Fried rice,American,Non-Veg,egg noodles tomato garlic peas salt chili coriander,Egg Fried rice egg noodles tomato garlic peas salt chili coriander
1460,Chicken Masala,Mexican,Non-Veg,chicken pasta capsicum onion peas coriander olive oil chili,Chicken Masala chicken pasta capsicum onion peas coriander olive oil chili
1461,Fish Masala,American,Non-Veg,fish soup carrot garlic spinach butter salt coriander,Fish Masala fish soup carrot garlic spinach butter salt coriander
1462,Mushroom Masala,Thai,Veg,mushroom bread tomato capsicum peas soy sauce olive oil butter,Mushroom Masala mushroom bread tomato capsicum peas soy sauce olive oil butter
1463,Chicken Biryani,Thai,Non-Veg,chicken salad carrot garlic capsicum olive oil butter chili,Chicken Biryani chicken salad carrot garlic capsicum olive oil butter chili
1464,Mushroom Soup,Japanese,Veg,mushroom salad peas tomato onion coriander pepper butter,Mushroom Soup mushroom salad peas tomato onion coriander pepper butter
1465,Fish Pasta bowl,Chinese,Non-Veg,fish rice spinach onion capsicum soy sauce coriander butter,Fish Pasta bowl fish rice spinach onion capsicum soy sauce coriander butter
1466,Paneer Masala,Mexican,Veg,paneer wrap capsicum onion tomato olive oil chili cumin,Paneer Masala paneer wrap capsicum onion tomato olive oil chili cumin
1467,Paneer Noodle bowl,Indian,Veg,paneer bread ginger onion peas salt chili olive oil,Paneer Noodle bowl paneer bread ginger onion peas salt chili olive oil
1468,Lentils Noodle bowl,American,Veg,lentils soup ginger garlic carrot butter chili pepper,Lentils Noodle bowl lentils soup ginger garlic carrot butter chili pepper
1469,Paneer Stir fry,American,Veg,paneer soup onion tomato garlic turmeric pepper soy sauce,Paneer Stir fry paneer soup onion tomato garlic turmeric pepper soy sauce
1470,Paneer Gravy,Thai,Veg,paneer wrap capsicum carrot spinach olive oil coriander pepper,Paneer Gravy paneer wrap capsicum carrot spinach olive oil coriander pepper
1471,Mushroom Pasta bowl,Indian,Veg,mushroom rice ginger carrot capsicum soy sauce olive oil cumin,Mushroom Pasta bowl mushroom rice ginger carrot capsicum soy sauce olive oil cumin
1472,Tofu Gravy,Mediterranean,Veg,tofu pasta garlic tomato ginger butter olive oil turmeric,Tofu Gravy tofu pasta garlic tomato ginger butter olive oil turmeric
1473,Mutton Pasta bowl,Mexican,Non-Veg,mutton soup capsicum onion spinach coriander butter cumin,Mutton Pasta bowl mutton soup capsicum onion spinach coriander butter cumin
1474,Beans Curry,Indian,Veg,beans salad peas ginger carrot chili soy sauce cumin,Beans Curry beans salad peas ginger carrot chili soy sauce cumin
1475,Tofu Pasta bowl,Japanese,Veg,tofu noodles tomato garlic peas chili pepper soy sauce,Tofu Pasta bowl tofu noodles tomato garlic peas chili pepper soy sauce
1476,Potato Noodle bowl,Italian,Veg,potato soup capsicum peas tomato olive oil turmeric chili,Potato Noodle bowl potato soup capsicum peas tomato olive oil turmeric chili
1477,Chickpeas Soup,Mediterranean,Veg,chickpeas wrap tomato spinach capsicum olive oil turmeric coriander,Chickpeas Soup chickpeas wrap tomato spinach capsicum olive oil turmeric coriander
1478,Chicken Fried rice,American,Non-Veg,chicken pasta onion tomato capsicum salt butter chili,Chicken Fried rice chicken pasta onion tomato capsicum salt butter chili
1479,Mushroom Fried rice,Japanese,Veg,mushroom salad carrot tomato onion turmeric salt pepper,Mushroom Fried rice mushroom salad carrot tomato onion turmeric salt pepper
1480,Potato Gravy,Japanese,Veg,potato salad ginger capsicum tomato turmeric olive oil salt,Potato Gravy potato salad ginger capsicum tomato turmeric olive oil salt
1481,Mutton Fried rice,Italian,Non-Veg,mutton bread carrot tomato capsicum coriander pepper soy sauce,Mutton Fried rice mutton bread carrot tomato capsicum coriander pepper soy sauce
1482,Chickpeas Soup,Indian,Veg,chickpeas bread tomato carrot peas turmeric coriander salt,Chickpeas Soup chickpeas bread tomato carrot peas turmeric coriander salt
1483,Mutton Biryani,Italian,Non-Veg,mutton noodles ginger garlic capsicum chili butter soy sauce,Mutton Biryani mutton noodles ginger garlic capsicum chili butter soy sauce
1484,Chickpeas Curry,Thai,Veg,chickpeas rice garlic spinach capsicum pepper chili butter,Chickpeas Curry chickpeas rice garlic spinach capsicum pepper chili butter
1485,Chickpeas Stir fry,Indian,Veg,chickpeas bread carrot peas ginger coriander olive oil butter,Chickpeas Stir fry chickpeas bread carrot peas ginger coriander olive oil butter
1486,Fish Soup,Japanese,Non-Veg,fish wrap onion carrot capsicum soy sauce cumin coriander,Fish Soup fish wrap onion carrot capsicum soy sauce cumin coriander
1487,Fish Gravy,Chinese,Non-Veg,fish bread peas spinach tomato cumin turmeric soy sauce,Fish Gravy fish bread peas spinach tomato cumin turmeric soy sauce
1488,Tofu Gravy,Mediterranean,Veg,tofu salad tomato onion capsicum olive oil soy sauce coriander,Tofu Gravy tofu salad tomato onion capsicum olive oil soy sauce coriander
1489,Fish Noodle bowl,Mexican,Non-Veg,fish soup ginger peas carrot soy sauce salt turmeric,Fish Noodle bowl fish soup ginger peas carrot soy sauce salt turmeric
1490,Paneer Noodle bowl,Chinese,Veg,paneer noodles tomato onion peas turmeric butter coriander,Paneer Noodle bowl paneer noodles tomato onion peas turmeric butter coriander
1491,Prawn Masala,Mexican,Non-Veg,prawn pasta carrot capsicum ginger coriander turmeric butter,Prawn Masala prawn pasta carrot capsicum ginger coriander turmeric butter
1492,Beans Curry,Japanese,Veg,beans salad tomato onion carrot coriander turmeric pepper,Beans Curry beans salad tomato onion carrot coriander turmeric pepper
1493,Potato Biryani,Italian,Veg,potato wrap capsicum spinach garlic coriander pepper butter,Potato Biryani potato wrap capsicum spinach garlic coriander pepper butter
1494,Paneer Masala,Japanese,Veg,paneer noodles ginger peas capsicum coriander cumin olive oil,Paneer Masala paneer noodles ginger peas capsicum coriander cumin olive oil
1495,Egg Curry,Mediterranean,Non-Veg,egg bread garlic ginger carrot salt cumin pepper,Egg Curry egg bread garlic ginger carrot salt cumin pepper
1496,Lentils Noodle bowl,American,Veg,lentils soup carrot onion spinach salt butter soy sauce,Lentils Noodle bowl lentils soup carrot onion spinach salt butter soy sauce
1497,Chickpeas Biryani,Chinese,Veg,chickpeas wrap capsicum spinach peas salt butter cumin,Chickpeas Biryani chickpeas wrap capsicum spinach peas salt butter cumin
1498,Chickpeas Biryani,Japanese,Veg,chickpeas rice onion peas capsicum turmeric cumin olive oil,Chickpeas Biryani chickpeas rice onion peas capsicum turmeric cumin olive oil
1499,Chickpeas Soup,Mediterranean,Veg,chickpeas bread spinach peas ginger olive oil cumin turmeric,Chickpeas Soup chickpeas bread spinach peas ginger olive oil cumin turmeric
1500,Mushroom Fried rice,Mediterranean,Veg,mushroom noodles carrot spinach onion cumin pepper butter,Mushroom Fried rice mushroom noodles carrot spinach onion cumin pepper butter
1501,Potato Masala,Italian,Veg,potato rice peas tomato ginger olive oil salt cumin,Potato Masala potato rice peas tomato ginger olive oil salt cumin
1502,Egg Noodle bowl,Indian,Non-Veg,egg wrap onion garlic peas butter chili turmeric,Egg Noodle bowl egg wrap onion garlic peas butter chili turmeric
1503,Paneer Noodle bowl,Italian,Veg,paneer salad ginger tomato spinach chili turmeric butter,Paneer Noodle bowl paneer salad ginger tomato spinach chili turmeric butter
1504,Beans Noodle bowl,Thai,Veg,beans rice spinach carrot tomato soy sauce turmeric olive oil,Beans Noodle bowl beans rice spinach carrot tomato soy sauce turmeric olive oil
1505,Prawn Gravy,Italian,Non-Veg,prawn salad onion spinach carrot chili olive oil salt,Prawn Gravy prawn salad onion spinach carrot chili olive oil salt
1506,Paneer Masala,Thai,Veg,paneer soup capsicum spinach onion coriander cumin butter,Paneer Masala paneer soup capsicum spinach onion coriander cumin butter
1507,Mutton Noodle bowl,Mediterranean,Non-Veg,mutton rice capsicum ginger carrot pepper coriander cumin,Mutton Noodle bowl mutton rice capsicum ginger carrot pepper coriander cumin
1508,Chicken Masala,Chinese,Non-Veg,chicken salad onion carrot tomato coriander cumin pepper,Chicken Masala chicken salad onion carrot tomato coriander cumin pepper
1509,Mutton Masala,Japanese,Non-Veg,mutton soup tomato onion ginger turmeric pepper chili,Mutton Masala mutton soup tomato onion ginger turmeric pepper chili
1510,Mushroom Pasta bowl,Chinese,Veg,mushroom pasta carrot capsicum tomato pepper salt butter,Mushroom Pasta bowl mushroom pasta carrot capsicum tomato pepper salt butter
1511,Chicken Biryani,Mediterranean,Non-Veg,chicken bread onion spinach capsicum turmeric chili cumin,Chicken Biryani chicken bread onion spinach capsicum turmeric chili cumin
1512,Egg Masala,Italian,Non-Veg,egg noodles ginger peas garlic salt pepper olive oil,Egg Masala egg noodles ginger peas garlic salt pepper olive oil
1513,Lentils Masala,Japanese,Veg,lentils salad onion spinach capsicum soy sauce coriander salt,Lentils Masala lentils salad onion spinach capsicum soy sauce coriander salt
1514,Chicken Masala,Japanese,Non-Veg,chicken pasta tomato ginger capsicum coriander turmeric cumin,Chicken Masala chicken pasta tomato ginger capsicum coriander turmeric cumin
1515,Paneer Noodle bowl,American,Veg,paneer rice spinach capsicum tomato butter coriander chili,Paneer Noodle bowl paneer rice spinach capsicum tomato butter coriander chili
1516,Paneer Biryani,Mediterranean,Veg,paneer rice peas garlic tomato cumin coriander chili,Paneer Biryani paneer rice peas garlic tomato cumin coriander chili
1517,Chickpeas Masala,Mexican,Veg,chickpeas rice carrot onion garlic cumin turmeric soy sauce,Chickpeas Masala chickpeas rice carrot onion garlic cumin turmeric soy sauce
1518,Chickpeas Biryani,American,Veg,chickpeas salad capsicum carrot garlic pepper chili salt,Chickpeas Biryani chickpeas salad capsicum carrot garlic pepper chili salt
1519,Egg Noodle bowl,American,Non-Veg,egg wrap capsicum onion garlic turmeric butter chili,Egg Noodle bowl egg wrap capsicum onion garlic turmeric butter chili
1520,Prawn Fried rice,American,Non-Veg,prawn noodles onion carrot ginger salt butter turmeric,Prawn Fried rice prawn noodles onion carrot ginger salt butter turmeric
1521,Beans Soup,Mediterranean,Veg,beans wrap spinach capsicum ginger soy sauce cumin butter,Beans Soup beans wrap spinach capsicum ginger soy sauce cumin butter
1522,Chickpeas Fried rice,American,Veg,chickpeas pasta ginger tomato peas butter soy sauce cumin,Chickpeas Fried rice chickpeas pasta ginger tomato peas butter soy sauce cumin
1523,Tofu Fried rice,Mexican,Veg,tofu wrap carrot tomato peas chili pepper olive oil,Tofu Fried rice tofu wrap carrot tomato peas chili pepper olive oil
1524,Potato Curry,Thai,Veg,potato pasta capsicum spinach garlic chili coriander butter,Potato Curry potato pasta capsicum spinach garlic chili coriander butter
1525,Prawn Masala,Japanese,Non-Veg,prawn pasta peas spinach onion chili butter pepper,Prawn Masala prawn pasta peas spinach onion chili butter pepper
1526,Chickpeas Fried rice,American,Veg,chickpeas pasta garlic ginger carrot olive oil butter cumin,Chickpeas Fried rice chickpeas pasta garlic ginger carrot olive oil butter cumin
1527,Paneer Curry,Thai,Veg,paneer bread ginger tomato spinach soy sauce salt coriander,Paneer Curry paneer bread ginger tomato spinach soy sauce salt coriander
1528,Mushroom Soup,Chinese,Veg,mushroom wrap garlic peas capsicum coriander pepper soy sauce,Mushroom Soup mushroom wrap garlic peas capsicum coriander pepper soy sauce
1529,Paneer Soup,Chinese,Veg,paneer salad onion tomato carrot coriander pepper butter,Paneer Soup paneer salad onion tomato carrot coriander pepper butter
1530,Egg Noodle bowl,Italian,Non-Veg,egg wrap spinach ginger capsicum pepper turmeric salt,Egg Noodle bowl egg wrap spinach ginger capsicum pepper turmeric salt
1531,Mushroom Gravy,Mexican,Veg,mushroom noodles carrot onion ginger cumin chili olive oil,Mushroom Gravy mushroom noodles carrot onion ginger cumin chili olive oil
1532,Potato Biryani,Thai,Veg,potato wrap peas ginger tomato pepper chili olive oil,Potato Biryani potato wrap peas ginger tomato pepper chili olive oil
1533,Beans Masala,Mediterranean,Veg,beans wrap spinach ginger carrot pepper butter salt,Beans Masala beans wrap spinach ginger carrot pepper butter salt
1534,Paneer Noodle bowl,Japanese,Veg,paneer soup onion peas capsicum cumin butter olive oil,Paneer Noodle bowl paneer soup onion peas capsicum cumin butter olive oil
1535,Mutton Soup,Thai,Non-Veg,mutton pasta garlic tomato onion coriander cumin butter,Mutton Soup mutton pasta garlic tomato onion coriander cumin butter
1536,Egg Soup,Italian,Non-Veg,egg wrap ginger onion capsicum chili salt butter,Egg Soup egg wrap ginger onion capsicum chili salt butter
1537,Fish Soup,Mediterranean,Non-Veg,fish rice spinach peas onion coriander soy sauce chili,Fish Soup fish rice spinach peas onion coriander soy sauce chili
1538,Mushroom Stir fry,Indian,Veg,mushroom pasta onion spinach ginger butter turmeric pepper,Mushroom Stir fry mushroom pasta onion spinach ginger butter turmeric pepper
1539,Mutton Soup,Italian,Non-Veg,mutton rice carrot tomato onion cumin salt butter,Mutton Soup mutton rice carrot tomato onion cumin salt butter
1540,Fish Stir fry,Mexican,Non-Veg,fish noodles garlic capsicum spinach cumin olive oil chili,Fish Stir fry fish noodles garlic capsicum spinach cumin olive oil chili
1541,Tofu Soup,Thai,Veg,tofu noodles peas capsicum garlic pepper soy sauce olive oil,Tofu Soup tofu noodles peas capsicum garlic pepper soy sauce olive oil
1542,Mushroom Soup,American,Veg,mushroom pasta garlic peas capsicum cumin pepper coriander,Mushroom Soup mushroom pasta garlic peas capsicum cumin pepper coriander
1543,Mushroom Pasta bowl,Mexican,Veg,mushroom noodles garlic onion spinach salt cumin turmeric,Mushroom Pasta bowl mushroom noodles garlic onion spinach salt cumin turmeric
1544,Egg Masala,Thai,Non-Veg,egg bread capsicum ginger carrot chili salt coriander,Egg Masala egg bread capsicum ginger carrot chili salt coriander
1545,Mutton Curry,Mediterranean,Non-Veg,mutton soup tomato carrot ginger turmeric pepper soy sauce,Mutton Curry mutton soup tomato carrot ginger turmeric pepper soy sauce
1546,Potato Gravy,Indian,Veg,potato bread peas onion capsicum pepper turmeric cumin,Potato Gravy potato bread peas onion capsicum pepper turmeric cumin
1547,Egg Soup,Mediterranean,Non-Veg,egg bread garlic ginger capsicum soy sauce pepper salt,Egg Soup egg bread garlic ginger capsicum soy sauce pepper salt
1548,Beans Fried rice,Mediterranean,Veg,beans rice garlic ginger carrot butter soy sauce pepper,Beans Fried rice beans rice garlic ginger carrot butter soy sauce pepper
1549,Fish Gravy,Chinese,Non-Veg,fish soup peas spinach ginger coriander cumin pepper,Fish Gravy fish soup peas spinach ginger coriander cumin pepper
1550,Paneer Stir fry,Thai,Veg,paneer wrap carrot onion ginger turmeric pepper cumin,Paneer Stir fry paneer wrap carrot onion ginger turmeric pepper cumin
1551,Egg Masala,Japanese,Non-Veg,egg soup garlic peas capsicum olive oil coriander chili,Egg Masala egg soup garlic peas capsicum olive oil coriander chili
1552,Fish Gravy,Mexican,Non-Veg,fish bread spinach peas garlic salt butter chili,Fish Gravy fish bread spinach peas garlic salt butter chili
1553,Egg Fried rice,Mediterranean,Non-Veg,egg soup spinach capsicum ginger cumin salt chili,Egg Fried rice egg soup spinach capsicum ginger cumin salt chili
1554,Tofu Stir fry,Italian,Veg,tofu bread garlic capsicum peas cumin salt pepper,Tofu Stir fry tofu bread garlic capsicum peas cumin salt pepper
1555,Mutton Stir fry,Mediterranean,Non-Veg,mutton bread spinach onion carrot turmeric chili salt,Mutton Stir fry mutton bread spinach onion carrot turmeric chili salt
1556,Prawn Noodle bowl,Chinese,Non-Veg,prawn noodles garlic tomato ginger cumin turmeric salt,Prawn Noodle bowl prawn noodles garlic tomato ginger cumin turmeric salt
1557,Egg Curry,American,Non-Veg,egg salad garlic spinach carrot soy sauce cumin salt,Egg Curry egg salad garlic spinach carrot soy sauce cumin salt
1558,Paneer Masala,Mediterranean,Veg,paneer wrap peas tomato ginger coriander cumin pepper,Paneer Masala paneer wrap peas tomato ginger coriander cumin pepper
1559,Potato Soup,Indian,Veg,potato noodles ginger capsicum carrot cumin salt chili,Potato Soup potato noodles ginger capsicum carrot cumin salt chili
1560,Lentils Curry,Chinese,Veg,lentils pasta tomato capsicum garlic cumin pepper soy sauce,Lentils Curry lentils pasta tomato capsicum garlic cumin pepper soy sauce
1561,Potato Stir fry,Thai,Veg,potato salad ginger spinach carrot butter olive oil turmeric,Potato Stir fry potato salad ginger spinach carrot butter olive oil turmeric
1562,Beans Noodle bowl,American,Veg,beans salad carrot ginger spinach salt butter cumin,Beans Noodle bowl beans salad carrot ginger spinach salt butter cumin
1563,Paneer Fried rice,American,Veg,paneer noodles garlic spinach tomato butter turmeric pepper,Paneer Fried rice paneer noodles garlic spinach tomato butter turmeric pepper
1564,Mutton Curry,Mediterranean,Non-Veg,mutton rice peas onion garlic cumin chili soy sauce,Mutton Curry mutton rice peas onion garlic cumin chili soy sauce
1565,Chicken Curry,Japanese,Non-Veg,chicken wrap tomato onion capsicum olive oil butter chili,Chicken Curry chicken wrap tomato onion capsicum olive oil butter chili
1566,Chicken Soup,Mediterranean,Non-Veg,chicken noodles tomato onion garlic coriander salt turmeric,Chicken Soup chicken noodles tomato onion garlic coriander salt turmeric
1567,Fish Pasta bowl,Chinese,Non-Veg,fish noodles tomato capsicum ginger cumin turmeric pepper,Fish Pasta bowl fish noodles tomato capsicum ginger cumin turmeric pepper
1568,Mushroom Gravy,American,Veg,mushroom wrap ginger tomato garlic coriander pepper olive oil,Mushroom Gravy mushroom wrap ginger tomato garlic coriander pepper olive oil
1569,Mushroom Biryani,Italian,Veg,mushroom soup onion capsicum carrot turmeric cumin butter,Mushroom Biryani mushroom soup onion capsicum carrot turmeric cumin butter
1570,Chicken Noodle bowl,Italian,Non-Veg,chicken bread ginger carrot peas chili salt coriander,Chicken Noodle bowl chicken bread ginger carrot peas chili salt coriander
1571,Mutton Masala,Mexican,Non-Veg,mutton rice capsicum ginger tomato soy sauce olive oil chili,Mutton Masala mutton rice capsicum ginger tomato soy sauce olive oil chili
1572,Prawn Pasta bowl,Thai,Non-Veg,prawn rice spinach capsicum carrot chili pepper turmeric,Prawn Pasta bowl prawn rice spinach capsicum carrot chili pepper turmeric
1573,Potato Gravy,American,Veg,potato pasta peas ginger capsicum olive oil coriander soy sauce,Potato Gravy potato pasta peas ginger capsicum olive oil coriander soy sauce
1574,Egg Soup,Indian,Non-Veg,egg salad peas carrot onion turmeric coriander salt,Egg Soup egg salad peas carrot onion turmeric coriander salt
1575,Beans Biryani,Mediterranean,Veg,beans bread capsicum garlic onion butter soy sauce turmeric,Beans Biryani beans bread capsicum garlic onion butter soy sauce turmeric
1576,Chicken Gravy,Japanese,Non-Veg,chicken noodles garlic peas spinach salt turmeric coriander,Chicken Gravy chicken noodles garlic peas spinach salt turmeric coriander
1577,Chicken Soup,Italian,Non-Veg,chicken salad tomato onion ginger butter coriander turmeric,Chicken Soup chicken salad tomato onion ginger butter coriander turmeric
1578,Chicken Curry,Chinese,Non-Veg,chicken salad carrot peas ginger butter pepper salt,Chicken Curry chicken salad carrot peas ginger butter pepper salt
1579,Tofu Stir fry,American,Veg,tofu soup onion tomato capsicum cumin olive oil chili,Tofu Stir fry tofu soup onion tomato capsicum cumin olive oil chili
1580,Mutton Masala,Indian,Non-Veg,mutton pasta tomato capsicum spinach chili butter salt,Mutton Masala mutton pasta tomato capsicum spinach chili butter salt
1581,Lentils Fried rice,American,Veg,lentils noodles capsicum carrot tomato turmeric olive oil cumin,Lentils Fried rice lentils noodles capsicum carrot tomato turmeric olive oil cumin
1582,Lentils Fried rice,Japanese,Veg,lentils soup peas onion carrot butter olive oil cumin,Lentils Fried rice lentils soup peas onion carrot butter olive oil cumin
1583,Paneer Biryani,Thai,Veg,paneer salad garlic peas tomato cumin butter pepper,Paneer Biryani paneer salad garlic peas tomato cumin butter pepper
1584,Potato Pasta bowl,Italian,Veg,potato salad ginger capsicum peas salt olive oil coriander,Potato Pasta bowl potato salad ginger capsicum peas salt olive oil coriander
1585,Beans Biryani,Chinese,Veg,beans salad peas tomato capsicum butter pepper soy sauce,Beans Biryani beans salad peas tomato capsicum butter pepper soy sauce
1586,Beans Stir fry,Chinese,Veg,beans pasta capsicum carrot onion soy sauce salt cumin,Beans Stir fry beans pasta capsicum carrot onion soy sauce salt cumin
1587,Chicken Soup,Mediterranean,Non-Veg,chicken pasta tomato peas garlic olive oil salt pepper,Chicken Soup chicken pasta tomato peas garlic olive oil salt pepper
1588,Paneer Stir fry,Chinese,Veg,paneer noodles peas onion garlic butter chili pepper,Paneer Stir fry paneer noodles peas onion garlic butter chili pepper
1589,Egg Gravy,American,Non-Veg,egg noodles garlic ginger capsicum soy sauce olive oil turmeric,Egg Gravy egg noodles garlic ginger capsicum soy sauce olive oil turmeric
1590,Beans Gravy,American,Veg,beans wrap peas garlic capsicum turmeric salt butter,Beans Gravy beans wrap peas garlic capsicum turmeric salt butter
